<?xml version="1.0" encoding="ISO-8859-1"?>

<menu xmlns:xsi="http://www.w3.org/2001/XMLSchema-instance" xsi:noNamespaceSchemaLocation="../../xsd/menu.xsd">
    <menuItem>
        <label>Applications</label>
        <application>
            <label>Sniffer</label>
            <controller>cz.pecrom.controller.apps.sniffer.SnifferController</controller>
            <view>cz.pecrom.view.apps.sniffer.Sniffer_Form</view>
        </application>               
    </menuItem>  
    <menuItem>
        <label>About</label>
        <application>
            <label>About</label>
            <controller>cz.pecrom.controller.main.AboutController</controller>
            <view>cz.pecrom.view.main.About_Form</view>
        </application>
    </menuItem>
</menu>